{
  "$schema": "https://json-schema.org/draft/2019-09/schema",
  "$id": "https://openodc.autozyx.com/schema/odc.schema.json",
  "title": "OpenODC Document Schema",
  "description": "JSON Schema for OpenODC documents. Aligned with GB/T 45312-2025 «Intelligent and connected vehicles — Operational design condition for automated driving system».",
  "version": "0.1.0",
  "type": "object",
  "required": ["id", "vendor", "model", "function_name", "ads_level", "elements", "metadata"],
  "properties": {
    "id": {
      "type": "string",
      "description": "Unique slug identifier, lowercase, hyphenated. e.g. byd-han-2026-dipilot-highway",
      "pattern": "^[a-z0-9]+(?:-[a-z0-9]+)*$"
    },
    "spec_version": {
      "type": "string",
      "description": "OpenODC schema version this document conforms to.",
      "default": "0.1.0"
    },
    "spec_source": {
      "type": "string",
      "description": "Reference standard.",
      "default": "GB/T 45312-2025"
    },
    "vendor": {
      "type": "string",
      "description": "Vendor name in Chinese, e.g. 比亚迪"
    },
    "vendor_en": {
      "type": "string",
      "description": "Vendor name in English, e.g. BYD"
    },
    "model": {
      "type": "string",
      "description": "Vehicle model designation, e.g. 汉 EV 2026 款"
    },
    "model_en": {
      "type": "string"
    },
    "function_name": {
      "type": "string",
      "description": "ADS function name, e.g. DiPilot Highway, NGP, Autopilot"
    },
    "function_name_en": {
      "type": "string"
    },
    "ads_level": {
      "type": "integer",
      "minimum": 0,
      "maximum": 5,
      "description": "ADS automation level per GB/T 40429-2021 (SAE J3016 equivalent)."
    },
    "software_version": {
      "type": ["string", "null"],
      "description": "Software/firmware version this ODC declaration applies to."
    },
    "hardware_config": {
      "type": ["string", "null"],
      "description": "Hardware configuration this ODC declaration applies to."
    },
    "effective_date": {
      "type": "string",
      "format": "date",
      "description": "ISO 8601 date when this ODC declaration takes effect."
    },

    "elements": {
      "type": "array",
      "description": "List of ODC elements as defined per GB/T 45312-2025.",
      "items": { "$ref": "#/$defs/ODCElement" },
      "minItems": 1
    },

    "associations": {
      "type": "array",
      "description": "Cross-element association rules (clause 5.4.c).",
      "items": { "$ref": "#/$defs/ODCAssociation" }
    },

    "boundary_combinations": {
      "type": "array",
      "description": "Lightweight cross-element boundary combinations. These are not a full SOTIF analysis; they identify public-source combinations where multiple ODC elements jointly form a boundary, trigger-condition candidate, or public disclosure gap.",
      "items": { "$ref": "#/$defs/ODCBoundaryCombination" }
    },

    "metadata": {
      "type": "object",
      "required": ["submitted_by", "submitted_at", "review_status"],
      "properties": {
        "submitted_by": {
          "type": "string",
          "description": "GitHub username or vendor account that submitted this record."
        },
        "submitted_at": {
          "type": "string",
          "format": "date-time"
        },
        "review_status": {
          "type": "string",
          "enum": ["draft", "community_reviewed", "vendor_confirmed"],
          "description": "draft = unreviewed; community_reviewed = peer reviewed via PR; vendor_confirmed = officially endorsed by the vendor."
        },
        "sources": {
          "type": "array",
          "description": "URLs or document references that back the data in this record.",
          "items": { "type": "string" }
        },
        "evidence_as_of": {
          "type": "string",
          "format": "date",
          "description": "Date when public evidence for this community-extracted record was last checked."
        },
        "notes": {
          "type": "string"
        }
      }
    }
  },

  "$defs": {
    "ODCElement": {
      "type": "object",
      "required": ["element_id", "requirement"],
      "properties": {
        "element_id": {
          "type": "string",
          "description": "Element id from the schema/categories/*.json registry. e.g. odd.road.type.highway.expressway",
          "pattern": "^(odd|personnel|vehicle)\\.[a-z0-9_]+(\\.[a-z0-9_]+)*$"
        },
        "requirement": {
          "type": "string",
          "enum": ["permitted", "not_permitted"],
          "description": "Per clause 5.4.b: 允许=permitted, 不允许=not_permitted."
        },
        "description": {
          "type": "string",
          "description": "Free-form description of the requirement. Equivalent to the «元素要求» column in the standard's example tables."
        },
        "parameter_range": {
          "type": ["string", "null"],
          "description": "Quantitative limits, e.g. '曲率半径 ≥ 150 m', '速度 0–120 km/h'."
        },
        "exit_behavior": {
          "type": ["string", "null"],
          "enum": [null, "suppress_activation", "trigger_exit", "suppress_and_exit"],
          "description": "Per clause 5.5: when requirement is not_permitted, must specify whether the element will suppress activation, trigger exit, or both."
        },
        "source": {
          "type": "object",
          "description": "Provenance metadata for this specific element entry.",
          "properties": {
            "type": {
              "type": "string",
              "enum": ["official", "owner_manual", "operating_rule", "government_notice", "media_test", "third_party_test", "regulatory_filing", "academic", "community_extracted", "inferred"]
            },
            "url": { "type": "string" },
            "confidence": {
              "type": "string",
              "enum": ["high", "medium", "low"]
            },
            "extracted_date": { "type": "string", "format": "date" }
          }
        },
        "evidence_refs": {
          "type": "array",
          "description": "One or more concrete references backing this element. Use for page numbers, app rule screenshots, official paragraphs, or issue links when the document-level source list is too coarse.",
          "items": { "$ref": "#/$defs/ODCEvidenceRef" }
        }
      }
    },

    "ODCBoundaryCombination": {
      "type": "object",
      "required": [
        "id",
        "title_zh",
        "title_en",
        "related_element_ids",
        "relation_to_odc",
        "evidence_level",
        "consumer_summary_zh",
        "consumer_summary_en",
        "developer_note_zh",
        "developer_note_en"
      ],
      "properties": {
        "id": {
          "type": "string",
          "description": "Stable slug within the ODC document.",
          "pattern": "^[a-z0-9]+(?:-[a-z0-9]+)*$"
        },
        "title_zh": { "type": "string" },
        "title_en": { "type": "string" },
        "related_element_ids": {
          "type": "array",
          "description": "ODC elements that jointly form this boundary combination.",
          "items": {
            "type": "string",
            "pattern": "^(odd|personnel|vehicle)\\.[a-z0-9_]+(\\.[a-z0-9_]+)*$"
          },
          "minItems": 2
        },
        "relation_to_odc": {
          "type": "string",
          "enum": ["inside_odc", "outside_odc", "boundary", "mixed_or_unknown"],
          "description": "Whether the combination is inside the declared boundary, outside it, near the boundary, or not clearly disclosed."
        },
        "evidence_level": {
          "type": "string",
          "enum": ["official", "manual_backed", "government_rule", "operating_rule", "community_extracted", "inferred", "public_gap"],
          "description": "Highest evidence level supporting the combination."
        },
        "trigger_condition_candidate": {
          "type": "boolean",
          "default": true,
          "description": "True when the combination can be treated as a SOTIF trigger-condition candidate for engineering review."
        },
        "affected_capability": {
          "type": "array",
          "items": {
            "type": "string",
            "enum": ["perception", "prediction", "planning", "control", "localization", "hmi", "remote_assistance", "driver_supervision", "operations"]
          }
        },
        "expected_response": {
          "type": ["string", "null"],
          "enum": [null, "suppress_activation", "trigger_exit", "suppress_and_exit", "degrade", "takeover_request", "driver_responsibility", "remote_assistance", "service_suspension", "not_disclosed"]
        },
        "condition_zh": { "type": "string" },
        "condition_en": { "type": "string" },
        "public_response_zh": { "type": "string" },
        "public_response_en": { "type": "string" },
        "consumer_summary_zh": { "type": "string" },
        "consumer_summary_en": { "type": "string" },
        "developer_note_zh": { "type": "string" },
        "developer_note_en": { "type": "string" },
        "evidence_refs": {
          "type": "array",
          "items": { "$ref": "#/$defs/ODCEvidenceRef" }
        }
      }
    },

    "ODCEvidenceRef": {
      "type": "object",
      "required": ["type", "confidence"],
      "properties": {
        "type": {
          "type": "string",
          "enum": ["official", "owner_manual", "operating_rule", "government_notice", "media_test", "third_party_test", "regulatory_filing", "academic", "community_extracted", "inferred"]
        },
        "url": { "type": "string" },
        "title": { "type": "string" },
        "section": { "type": "string" },
        "page": { "type": ["integer", "string", "null"] },
        "confidence": {
          "type": "string",
          "enum": ["high", "medium", "low"]
        },
        "extracted_date": { "type": "string", "format": "date" },
        "notes": { "type": "string" }
      }
    },

    "ODCAssociation": {
      "type": "object",
      "required": ["primary_id", "dependent_id", "relation", "description"],
      "properties": {
        "primary_id": {
          "type": "string",
          "description": "The 'primary' element (主 ODC 元素) per clause 5.4.c."
        },
        "dependent_id": {
          "type": "string",
          "description": "The 'dependent' element (从 ODC 元素) per clause 5.4.c."
        },
        "relation": {
          "type": "string",
          "enum": ["requires_permitted", "requires_not_permitted", "limits_range"],
          "description": "Type of cross-element constraint."
        },
        "description": {
          "type": "string",
          "description": "Human-readable explanation of the constraint."
        }
      }
    }
  }
}
